<?xml version="1.0" encoding="UTF-8"?>
<festival xmlns:xsi="http://www.w3.org/2001/XMLSchema-instance" id="desert-pulse-2026" xsi:noNamespaceSchemaLocation="festival.xsd">
    <info>
        <name>Desert Pulse Festival</name>
        <year>2026</year>
        <edition>1</edition>
        <location>Solara Desert Park, Arizona, USA</location>
        <startDate>2026-04-17</startDate>
        <endDate>2026-04-19</endDate>
        <description>A fictional three-day desert music and arts festival combining indie, electronic, hip-hop, workshops, visual installations, and night-time desert experiences.</description>
        <ticketUrl>https://example.com/desert-pulse/tickets</ticketUrl>
        <website>https://example.com/desert-pulse</website>
    </info>
    <venues>
        <venue id="v1">
            <name>Solar Stage</name>
            <capacity>20000</capacity>
            <description>Main open-air stage for headliners and large concerts.</description>
            <area>North Field</area>
            <geo>34.101,-111.021</geo>
        </venue>
        <venue id="v2">
            <name>Mirage Tent</name>
            <capacity>8000</capacity>
            <description>Covered tent focused on electronic, experimental, and late-night sets.</description>
            <area>East Dunes</area>
            <geo>34.098,-111.018</geo>
        </venue>
        <venue id="v3">
            <name>Dune Arena</name>
            <capacity>12000</capacity>
            <description>Outdoor arena for indie, hip-hop, and alternative shows.</description>
            <area>South Ridge</area>
            <geo>34.095,-111.026</geo>
        </venue>
        <venue id="v4">
            <name>Oasis Workshop Dome</name>
            <capacity>1500</capacity>
            <description>Small venue for talks, workshops, acoustic sessions, and artist meetings.</description>
            <area>Central Oasis</area>
            <geo>34.099,-111.022</geo>
        </venue>
    </venues>
    <performers>
        <performer id="p1">
            <name>Lunar Waves</name>
            <genre>Electronic</genre>
            <country>USA</country>
            <bio>Lunar Waves brings a distinctive electronic sound to the desert, mixing live performance with immersive festival energy.</bio>
        </performer>
        <performer id="p2">
            <name>Neon Horizon</name>
            <genre>Indie</genre>
            <country>UK</country>
            <bio>Neon Horizon brings a distinctive indie sound to the desert, mixing live performance with immersive festival energy.</bio>
        </performer>
        <performer id="p3">
            <name>Desert Echo</name>
            <genre>Alternative</genre>
            <country>Australia</country>
            <bio>Desert Echo brings a distinctive alternative sound to the desert, mixing live performance with immersive festival energy.</bio>
        </performer>
        <performer id="p4">
            <name>Solar Nomads</name>
            <genre>Hip-Hop</genre>
            <country>Canada</country>
            <bio>Solar Nomads brings a distinctive hip-hop sound to the desert, mixing live performance with immersive festival energy.</bio>
        </performer>
        <performer id="p5">
            <name>Mirage Bloom</name>
            <genre>Experimental</genre>
            <country>Germany</country>
            <bio>Mirage Bloom brings a distinctive experimental sound to the desert, mixing live performance with immersive festival energy.</bio>
        </performer>
        <performer id="p6">
            <name>Crystal Coyote</name>
            <genre>Ambient</genre>
            <country>France</country>
            <bio>Crystal Coyote brings a distinctive ambient sound to the desert, mixing live performance with immersive festival energy.</bio>
        </performer>
        <performer id="p7">
            <name>Midnight Caravan</name>
            <genre>Synth-pop</genre>
            <country>Mexico</country>
            <bio>Midnight Caravan brings a distinctive synth-pop sound to the desert, mixing live performance with immersive festival energy.</bio>
        </performer>
        <performer id="p8">
            <name>Velvet Comet</name>
            <genre>World Fusion</genre>
            <country>Spain</country>
            <bio>Velvet Comet brings a distinctive world fusion sound to the desert, mixing live performance with immersive festival energy.</bio>
        </performer>
        <performer id="p9">
            <name>Static Palms</name>
            <genre>Electronic</genre>
            <country>Japan</country>
            <bio>Static Palms brings a distinctive electronic sound to the desert, mixing live performance with immersive festival energy.</bio>
        </performer>
        <performer id="p10">
            <name>Golden Circuit</name>
            <genre>Indie</genre>
            <country>Brazil</country>
            <bio>Golden Circuit brings a distinctive indie sound to the desert, mixing live performance with immersive festival energy.</bio>
        </performer>
        <performer id="p11">
            <name>Blue Ember</name>
            <genre>Alternative</genre>
            <country>Netherlands</country>
            <bio>Blue Ember brings a distinctive alternative sound to the desert, mixing live performance with immersive festival energy.</bio>
        </performer>
        <performer id="p12">
            <name>Dustline Choir</name>
            <genre>Hip-Hop</genre>
            <country>Czech Republic</country>
            <bio>Dustline Choir brings a distinctive hip-hop sound to the desert, mixing live performance with immersive festival energy.</bio>
        </performer>
        <performer id="p13">
            <name>Prism Jackals</name>
            <genre>Experimental</genre>
            <country>USA</country>
            <bio>Prism Jackals brings a distinctive experimental sound to the desert, mixing live performance with immersive festival energy.</bio>
        </performer>
        <performer id="p14">
            <name>Electric Saguaro</name>
            <genre>Ambient</genre>
            <country>UK</country>
            <bio>Electric Saguaro brings a distinctive ambient sound to the desert, mixing live performance with immersive festival energy.</bio>
        </performer>
        <performer id="p15">
            <name>The Sand Frequencies</name>
            <genre>Synth-pop</genre>
            <country>Australia</country>
            <bio>The Sand Frequencies brings a distinctive synth-pop sound to the desert, mixing live performance with immersive festival energy.</bio>
        </performer>
        <performer id="p16">
            <name>Nova Caravan</name>
            <genre>World Fusion</genre>
            <country>Canada</country>
            <bio>Nova Caravan brings a distinctive world fusion sound to the desert, mixing live performance with immersive festival energy.</bio>
        </performer>
        <performer id="p17">
            <name>Amber Signals</name>
            <genre>Electronic</genre>
            <country>Germany</country>
            <bio>Amber Signals brings a distinctive electronic sound to the desert, mixing live performance with immersive festival energy.</bio>
        </performer>
        <performer id="p18">
            <name>Wild Mesa</name>
            <genre>Indie</genre>
            <country>France</country>
            <bio>Wild Mesa brings a distinctive indie sound to the desert, mixing live performance with immersive festival energy.</bio>
        </performer>
        <performer id="p19">
            <name>Cactus Radio</name>
            <genre>Alternative</genre>
            <country>Mexico</country>
            <bio>Cactus Radio brings a distinctive alternative sound to the desert, mixing live performance with immersive festival energy.</bio>
        </performer>
        <performer id="p20">
            <name>Echo Atlas</name>
            <genre>Hip-Hop</genre>
            <country>Spain</country>
            <bio>Echo Atlas brings a distinctive hip-hop sound to the desert, mixing live performance with immersive festival energy.</bio>
        </performer>
        <performer id="p21">
            <name>Silver Mirage</name>
            <genre>Experimental</genre>
            <country>Japan</country>
            <bio>Silver Mirage brings a distinctive experimental sound to the desert, mixing live performance with immersive festival energy.</bio>
        </performer>
        <performer id="p22">
            <name>Sunset Operators</name>
            <genre>Ambient</genre>
            <country>Brazil</country>
            <bio>Sunset Operators brings a distinctive ambient sound to the desert, mixing live performance with immersive festival energy.</bio>
        </performer>
        <performer id="p23">
            <name>Moonlit Engines</name>
            <genre>Synth-pop</genre>
            <country>Netherlands</country>
            <bio>Moonlit Engines brings a distinctive synth-pop sound to the desert, mixing live performance with immersive festival energy.</bio>
        </performer>
        <performer id="p24">
            <name>The Heatwave Poets</name>
            <genre>World Fusion</genre>
            <country>Czech Republic</country>
            <bio>The Heatwave Poets brings a distinctive world fusion sound to the desert, mixing live performance with immersive festival energy.</bio>
        </performer>
        <performer id="p25">
            <name>Neon Dunes</name>
            <genre>Electronic</genre>
            <country>USA</country>
            <bio>Neon Dunes brings a distinctive electronic sound to the desert, mixing live performance with immersive festival energy.</bio>
        </performer>
        <performer id="p26">
            <name>Paper Satellites</name>
            <genre>Indie</genre>
            <country>UK</country>